{
  "schema_version": "1.0.0",
  "chunk_id": "chk-demo-0001",
  "document_id": "doc-demo-0001",
  "source_id": "src-demo-0001",
  "sequence": 0,
  "heading": "引言",
  "text": "这是一段用于测试的分块文本，长度在合理范围内，模拟清洗后的正文段落。",
  "estimated_tokens": 25,
  "char_start": 0,
  "char_end": 38,
  "created_at": "2026-09-30T09:20:00+08:00",
  "updated_at": "2026-09-30T09:20:00+08:00"
}
